[{"oznaka" : "T1162", "adresa" : "Vugrovečka cesta 62", "mjesto" : "Dobrodol", "geo_sirina" : 45.85434, "geo_duzina" : 16.11278, "ocjena" : 5, "broj_glasova" : 2, "otvaranje" : "7:00", "zatvaranje" : "21:00", "ima_zeleni_hell" : true, "artikli" : [{"naziv" : "Gazirana mineralna voda", "cijena" : 0.59}, {"naziv" : "Krem puding Galetta", "cijena" : 1.09}]}, {"oznaka" : "T876", "adresa" : "Zagrebačka cesta 9", "mjesto" : "Sesvete", "geo_sirina" : 45.82747, "geo_duzina" : 16.10799, "ocjena" : 3.7, "broj_glasova" : 31, "otvaranje" : "7:00", "zatvaranje" : "22:00", "ima_zeleni_hell" : false, "artikli" : [{"naziv" : "Pirovo integralno brašno", "cijena" : 1.89}]}, {"oznaka" : "T1160", "adresa" : "Bjelovarska ulica 2", "mjesto" : "Sesvete", "geo_sirina" : 45.82691, "geo_duzina" : 16.11117, "ocjena" : 5, "broj_glasova" : 3, "otvaranje" : "6:30", "zatvaranje" : "21:00", "ima_zeleni_hell" : true, "artikli" : [{"naziv" : "Tortilja", "cijena" : 1.89}, {"naziv" : "Šibice", "cijena" : 0.89}]}, {"oznaka" : "T1167", "adresa" : "Varaždinska cesta 90", "mjesto" : "Popovec", "geo_sirina" : 45.85068, "geo_duzina" : 16.14063, "ocjena" : 4.4, "broj_glasova" : 5, "otvaranje" : "7:00", "zatvaranje" : "21:00", "ima_zeleni_hell" : true, "artikli" : [{"naziv" : "Carska mješavina", "cijena" : 1.65}, {"naziv" : "Vitaminski napitak", "cijena" : 4.19}]}, {"oznaka" : "T1163", "adresa" : "Augusta Šenoe 49", "mjesto" : "Vugrovec", "geo_sirina" : 45.88053, "geo_duzina" : 16.10886, "ocjena" : 3.3, "broj_glasova" : 6, "otvaranje" : "6:30", "zatvaranje" : "21:00", "ima_zeleni_hell" : false, "artikli" : [{"naziv" : "Pašteta losos", "cijena" : 2.39}]}, {"oznaka" : "T1705", "adresa" : "Žugčićeva 22", "mjesto" : "Novoselec", "geo_sirina" : 45.84942, "geo_duzina" : 16.08261, "ocjena" : 5, "broj_glasova" : 1, "otvaranje" : "7:00", "zatvaranje" : "21:00", "ima_zeleni_hell" : false, "artikli" : [{"naziv" : "Osvježivač prostora", "cijena" : 3.99}, {"naziv" : "Panirani riblji štapići", "cijena" : 2.39}, {"naziv" : "Pašteta jetrena", "cijena" : 0.65}]}, {"oznaka" : "T1166", "adresa" : "Ulica kaktusa 5", "mjesto" : "Brestje", "geo_sirina" : 45.82746, "geo_duzina" : 16.08519, "ocjena" : 3.7, "broj_glasova" : 3, "otvaranje" : "7:00", "zatvaranje" : "21:00", "ima_zeleni_hell" : true, "artikli" : [{"naziv" : "Puding", "cijena" : 0.49}, {"naziv" : "Grah bijeli", "cijena" : 1.69}, {"naziv" : "Jabuka Idared", "cijena" : 1.27}]}, {"oznaka" : "T1415", "adresa" : "Oporovečki vinogradi 17", "mjesto" : "Oporovec", "geo_sirina" : 45.85384, "geo_duzina" : 16.0578, "ocjena" : 3, "broj_glasova" : 6, "otvaranje" : "7:00", "zatvaranje" : "22:00", "ima_zeleni_hell" : true, "artikli" : [{"naziv" : "Keks Choco cookie", "cijena" : 1.89}, {"naziv" : "Tjestenina filini", "cijena" : 0.98}, {"naziv" : "Grah šareni", "cijena" : 1.29}, {"naziv" : "Potpuna hrana za mačke", "cijena" : 0.65}, {"naziv" : "Ćevapčići", "cijena" : 8.99}, {"naziv" : "Mliječni napitak", "cijena" : 0.69}, {"naziv" : "Pečena šunka", "cijena" : 10.99}]}, {"oznaka" : "T1164", "adresa" : "Zagrebačka cesta 4C", "mjesto" : "Sesvete", "geo_sirina" : 45.82796, "geo_duzina" : 16.10796, "ocjena" : 5, "broj_glasova" : 1, "otvaranje" : "6:30", "zatvaranje" : "21:00", "ima_zeleni_hell" : true, "artikli" : [{"naziv" : "Čokolada ledena", "cijena" : 1.29}, {"naziv" : "Kikiriki", "cijena" : 1.29}, {"naziv" : "Četvrt mlade kokoši", "cijena" : 1.89}]}, {"oznaka" : "T1161", "adresa" : "Trg Antuna Mihanovića 4", "mjesto" : "Sesvete", "geo_sirina" : 45.8294, "geo_duzina" : 16.07957, "ocjena" : 4.8, "broj_glasova" : 6, "otvaranje" : "7:00", "zatvaranje" : "22:00", "ima_zeleni_hell" : false, "artikli" : [{"naziv" : "Kukuruz šećerac", "cijena" : 0.95}]}]
